Active;Category_ID;Description;Name;Parent_category
1;9;Aby w stu procentach cieszyć się z jazdy na rowerze należy odpowiednio o niego zadbać. Właśnie dlatego tak istotne są regularna konserwacja i niezwłoczne usuwanie usterek w jednośladzie. Wiele podstawowych czynności serwisowych można wykonać samodzielnie w warunkach domowych. Niektórzy poradzą sobie też z bardziej skomplikowanymi naprawami. Niezbędne będzie do tego jednak odpowiednie wyposażenie warsztatu rowerowego.;warsztat rowerowy;Strona główna
1;10;Szukasz akcesoriów, które sprawią, że Twoja jazda rowerem będzie jeszcze przyjemniejsza? U nas z pewnością znajdziesz wszystko, czego potrzebujesz. Niezależnie od tego, czy dopiero rozpoczynasz swoją przygodę z jazdą na dwóch kółkach, czy jesteś zapalonym kolarzem - zawsze warto zainwestować w akcesoria zapewniające większą wygodę i bezpieczeństwo podczas poruszania się jednośladem. Koniecznie zapoznaj się z naszą ofertą! ;akcesoria;Strona główna
1;11;Jazda na rowerze to ta forma aktywności fizycznej, którą wybiera coraz więcej osób. Należy jednak pamiętać, że częste eksploatowanie jednośladu nieodłącznie wiąże się z pogorszeniem stanu technicznego poszczególnych komponentów. Części rowerowe dostępne w szerokim asortymencie naszego sklepu pasują do każdego modelu, dzięki czemu znajdziesz i dopasujesz je do własnych potrzeb. W ofercie mamy niezawodne, wytrzymałe i solidne produkty renomowanych producentów, a także tanie części rowerowe, które zachęcają nie tylko korzystną ceną, ale również dobrą jakością wykonania. Nie czekaj, sprawdź sam!;części;Strona główna
1;12;Odzież rowerowa uszyta z myślą o aktywności na rowerze jest przemyślana pod względem kroju i zastosowanych tkanin. Wysokiej klasy materiały syntetyczne nie chłoną potu, w przeciwieństwie do „zwykłej” bawełny. Specjalne membrany w spodniach i kurtkach przeciwdeszczowych pozwalają na parowanie potu na zewnątrz, a jednocześnie zatrzymują deszcz z dala od skóry. Bielizna polarowa i wełniana grzeje, a dopasowany raglanowy krój strojów kolarskich poprawia aerodynamikę kolarza. ;odzież rowerowa;Strona główna
1;4;Bagażnik rowerowy jest sprawdzonym sposobem na przewóz ładunków jednośladem. Propozycje od marek Pletscher, Accent czy Author przydają się w mieście, na krótkich dystansach oraz podczas długich wypraw rowerowych. Z ich pomocą bez problemu przewieziemy teczkę, plecak lub torbę z zakupami. Bagażniki rowerowe, jak te od XCL świetnie nadają się do montażu toreb rowerowych lub sakw, dzięki którym są w stanie udźwignąć ekwipunek ważący nawet kilkadziesiąt kilogramów.;bagażniki rowerowe;akcesoria
1;7;Bielizna na rower to bardzo praktyczny element kolarskiej garderoby. Nie tylko zapewnia odpowiedni komfort, ale pozwala także na właściwą wentylację, co przekłada się na sprawne odprowadzanie potu. To niezwykle istotne szczególnie dla osób, które jeżdżą wyczynowo, dając z siebie wszystko podczas intensywnych treningów lub wyścigów kolarskich. Na CentrumRowerowe.pl znajdziesz bieliznę rowerową od najpopularniejszych marek, takich jak Assos, Castelli, Brubeck, Endura, POC, Craft, FOX, POC, Oakley i wiele innych.;bielizna rowerowa;odzież rowerowa
1;1;Stojak serwisowy do rowerów to niezbędny element wyposażenia profesjonalnych warsztatów. Coraz częściej wybierany jest także przez majsterkowiczów, którym ułatwia on pielęgnację, konserwację oraz naprawy. Na CentrumRowerowe.pl dostępny jest szereg produktów renomowanych marek. Osoby poszukujące wygodnego akcesorium do garażu będą zadowolone z funkcjonalności produktów Bike Hand czy Eyen. Fachowcy natomiast najczęściej poszukują jakości premium, jaką ofertują m.in.: Park Tool i Peruzzo.;stojaki serwisowe na rower;warsztat rowerowy
1;6;Jeżeli szukasz sposobu na wyeliminowanie problemów z napędem podczas jazdy, szczególnie w terenie, gdy konieczne jest pokonywanie różnych nierówności – warto zainwestować w porządny napinacz łańcucha rowerowego. Ten nieduży komponent chroni łańcuch przed spadaniem, a każdy rowerzysta wie, jak nieprzyjemną i irytującą sytuacją potrafi być taki incydent, zmuszający nas do przerwy w jeździe. Wyposażając się więc w napinacz łańcucha, możemy zaoszczędzić sporo nerwów i czasu podczas górskich czy leśnych wypraw.;rowerowe napinacze łańcucha;części
1;3;Koniec z pobrudzonym ubraniem podczas jazdy przy niesprzyjającej pogodzie! Błotniki rowerowe to komponenty, które szczególnie przydają się podczas wiosenno- jesiennych dojazdów do pracy. Rowery trekkingowe oraz miejskie wyposażone są zazwyczaj w wersje pełne, natomiast w MTB stosuje się krótkie błotniki rowerowe. Wielu producentów amortyzatorów oferuje małe, ale skuteczne błotniki mocowane do korony widelca. Oferta naszego sklepu zawiera pełną gamę błotników rowerowych przeznaczonych do kół w każdym rozmiarze.;błotniki rowerowe;akcesoria
1;2;Dostępne w naszej ofercie narzędzia rowerowe sprawdzą się podczas serwisowania jednośladu w przydomowym warsztacie oraz usuwania nagłych awarii na trasie. Wśród nich są zarówno przyrządy uniwersalne, jak i specjalistyczne. Do wyboru mamy m.in. praktyczne i kompaktowe multitoole, komplety warsztatowe w walizkach, a także szeroki wybór kluczy do suportów, kaset i korb.;narzędzia-rowerowe;warsztat rowerowy
1;5;Grupy osprzętu to zestawy komponentów niezbędnych do prawidłowego działania roweru. Na CentrumRowerowe.pl znajdziesz produkty od najpopularniejszych kolarskich marek, takich jak Shimano, czy SRAM. Coś dla siebie bez problemu znajdą zarówno mniej, jak i bardziej zaawansowani rowerzyści. Dla tradycjonalistów odpowiednie będą grupy mechaniczne, natomiast zwolennicy najnowocześniejszych technologii z pewnością będą zadowoleni z osprzętu elektronicznego Di2 lub AXS.;grupy osprzętu;części
1;8;Bluza rowerowa to bardzo ważny element w garderobie każdego rowerzysty. Zapewnia komfort termiczny, dzięki czemu nie trzeba rezygnować z aktywności nawet w chłodne dni. To idealny wybór na okresy przejściowe, takie jak wiosna czy jesień, kiedy temperatura powoli spada. Na CentrumRowerowe.pl odkryjesz świetne bluzy kolarskie od uznanych marek – z pewnością wybierzesz coś dla siebie spośród szerokiej oferty!;bluzy rowerowe;odzież rowerowa